{
  "$schema": "./schema.json",
  "last_updated": "2026-10-24T12:00:00.000000+00:00",
  "total_courses": 20,
  "active_courses": 20,
  "courses": [
    {
      "id": "harvard-cs50x",
      "title": "CS50x: Introduction to Computer Science",
      "institution": "Harvard University",
      "platform": "Harvard Online / CS50",
      "category": "Computer Science",
      "level": "Beginner",
      "duration_hours": 120,
      "url": "https://cs50.harvard.edu/x/",
      "status": "Active",
      "certificate_offered": true,
      "certificate_type": "Free Verified Certificate",
      "prerequisites": "None",
      "verification_date": "2026-10-24",
      "inspection_notes": "100% free curriculum with full video lectures, problem sets, and a free verified Harvard certificate on score 70%+.",
      "is_paywall_free": true,
      "syllabus_completeness_pct": 100,
      "free_learning_materials": ["Full Video Lectures", "Interactive Problem Sets", "Cloud IDE", "Discord Community", "Free Certificate"],
      "visual_proof": {
        "screenshot_path": "docs/screenshots/harvard-cs50x.png",
        "screenshot_url": "docs/screenshots/harvard-cs50x.png",
        "captured_at": "2026-10-24T12:00:00.000000+00:00",
        "status": "verified",
        "paywall_free_confirmed": true,
        "trial_trap_detected": false,
        "locked_modules_detected": false
      }
    },
    {
      "id": "harvard-cs50p",
      "title": "CS50P: Introduction to Programming with Python",
      "institution": "Harvard University",
      "platform": "Harvard Online / CS50",
      "category": "Computer Science",
      "level": "Beginner",
      "duration_hours": 80,
      "url": "https://cs50.harvard.edu/python/",
      "status": "Active",
      "certificate_offered": true,
      "certificate_type": "Free Verified Certificate",
      "prerequisites": "None",
      "verification_date": "2026-10-24",
      "inspection_notes": "Comprehensive Python foundations from David J. Malan. Free automated grading and free verified certificate.",
      "is_paywall_free": true,
      "syllabus_completeness_pct": 100,
      "free_learning_materials": ["Video Lectures", "Automated Testing Suite (check50)", "Coding Exercises", "Free Certificate"],
      "visual_proof": {
        "screenshot_path": "docs/screenshots/harvard-cs50p.png",
        "screenshot_url": "docs/screenshots/harvard-cs50p.png",
        "captured_at": "2026-10-24T12:00:00.000000+00:00",
        "status": "verified",
        "paywall_free_confirmed": true,
        "trial_trap_detected": false,
        "locked_modules_detected": false
      }
    },
    {
      "id": "harvard-cs50ai",
      "title": "CS50AI: Introduction to Artificial Intelligence with Python",
      "institution": "Harvard University",
      "platform": "Harvard Online / CS50",
      "category": "Artificial Intelligence",
      "level": "Intermediate",
      "duration_hours": 90,
      "url": "https://cs50.harvard.edu/ai/",
      "status": "Active",
      "certificate_offered": true,
      "certificate_type": "Free Verified Certificate",
      "prerequisites": "CS50x or Python experience",
      "verification_date": "2026-10-24",
      "inspection_notes": "Explores graph search, machine learning, neural networks, and NLP with Python. Free verified certificate included.",
      "is_paywall_free": true,
      "syllabus_completeness_pct": 100,
      "free_learning_materials": ["Algorithms & AI Theory", "Hands-on Python Projects", "Automated Grading", "Free Certificate"],
      "visual_proof": {
        "screenshot_path": "docs/screenshots/harvard-cs50ai.png",
        "screenshot_url": "docs/screenshots/harvard-cs50ai.png",
        "captured_at": "2026-10-24T12:00:00.000000+00:00",
        "status": "verified",
        "paywall_free_confirmed": true,
        "trial_trap_detected": false,
        "locked_modules_detected": false
      }
    },
    {
      "id": "mit-ocw-6-0001",
      "title": "Introduction to Computer Science and Programming in Python",
      "institution": "Massachusetts Institute of Technology (MIT)",
      "platform": "MIT OpenCourseWare",
      "category": "Computer Science",
      "level": "Beginner",
      "duration_hours": 60,
      "url": "https://ocw.mit.edu/courses/6-0001-introduction-to-computer-science-and-programming-in-python-fall-2016/",
      "status": "Active",
      "certificate_offered": false,
      "certificate_type": "Audit Only (No Free Cert)",
      "prerequisites": "High school algebra",
      "verification_date": "2026-10-24",
      "inspection_notes": "Gold-standard MIT curriculum by Prof. Ana Bell and Prof. Eric Grimson. Complete video lectures, assignments, and exams.",
      "is_paywall_free": true,
      "syllabus_completeness_pct": 100,
      "free_learning_materials": ["Full Lecture Videos", "Lecture Transcripts", "Problem Sets with Solutions", "Exams with Solutions"],
      "visual_proof": {
        "screenshot_path": "docs/screenshots/mit-ocw-6-0001.png",
        "screenshot_url": "docs/screenshots/mit-ocw-6-0001.png",
        "captured_at": "2026-10-24T12:00:00.000000+00:00",
        "status": "verified",
        "paywall_free_confirmed": true,
        "trial_trap_detected": false,
        "locked_modules_detected": false
      }
    },
    {
      "id": "mit-ocw-18-06",
      "title": "Linear Algebra (Gilbert Strang)",
      "institution": "Massachusetts Institute of Technology (MIT)",
      "platform": "MIT OpenCourseWare",
      "category": "Mathematics & Algorithms",
      "level": "Intermediate",
      "duration_hours": 75,
      "url": "https://ocw.mit.edu/courses/18-06-linear-algebra-spring-2010/",
      "status": "Active",
      "certificate_offered": false,
      "certificate_type": "Audit Only (No Free Cert)",
      "prerequisites": "Multivariable Calculus",
      "verification_date": "2026-10-24",
      "inspection_notes": "Legendary linear algebra course by Gilbert Strang. 35 video lectures, exams, solutions, and MATLAB demos.",
      "is_paywall_free": true,
      "syllabus_completeness_pct": 100,
      "free_learning_materials": ["35 Video Lectures", "Homework & Exam Solutions", "Instructor Notes"],
      "visual_proof": {
        "screenshot_path": "docs/screenshots/mit-ocw-18-06.png",
        "screenshot_url": "docs/screenshots/mit-ocw-18-06.png",
        "captured_at": "2026-10-24T12:00:00.000000+00:00",
        "status": "verified",
        "paywall_free_confirmed": true,
        "trial_trap_detected": false,
        "locked_modules_detected": false
      }
    },
    {
      "id": "mit-ocw-6-006",
      "title": "Introduction to Algorithms",
      "institution": "Massachusetts Institute of Technology (MIT)",
      "platform": "MIT OpenCourseWare",
      "category": "Mathematics & Algorithms",
      "level": "Intermediate",
      "duration_hours": 90,
      "url": "https://ocw.mit.edu/courses/6-006-introduction-to-algorithms-spring-2020/",
      "status": "Active",
      "certificate_offered": false,
      "certificate_type": "Audit Only (No Free Cert)",
      "prerequisites": "Python and Discrete Math",
      "verification_date": "2026-10-24",
      "inspection_notes": "Rigorous algorithm design, asymptotic analysis, dynamic programming, and shortest path algorithms.",
      "is_paywall_free": true,
      "syllabus_completeness_pct": 100,
      "free_learning_materials": ["Spring 2020 Video Lectures", "Recitations", "Problem Sets", "Python Code Repos"],
      "visual_proof": {
        "screenshot_path": "docs/screenshots/mit-ocw-6-006.png",
        "screenshot_url": "docs/screenshots/mit-ocw-6-006.png",
        "captured_at": "2026-10-24T12:00:00.000000+00:00",
        "status": "verified",
        "paywall_free_confirmed": true,
        "trial_trap_detected": false,
        "locked_modules_detected": false
      }
    },
    {
      "id": "helsinki-fullstackopen",
      "title": "Full Stack Open: Deep Dive Into Modern Web Development",
      "institution": "University of Helsinki",
      "platform": "Full Stack Open",
      "category": "Web Development",
      "level": "Intermediate",
      "duration_hours": 180,
      "url": "https://fullstackopen.com/en/",
      "status": "Active",
      "certificate_offered": true,
      "certificate_type": "Free Verified Certificate",
      "prerequisites": "Good programming skills in any language",
      "verification_date": "2026-10-24",
      "inspection_notes": "World-renowned production web development curriculum covering React, Redux, Node.js, MongoDB, GraphQL, TypeScript, and CI/CD. Free certificate with optional European ECTS university credits.",
      "is_paywall_free": true,
      "syllabus_completeness_pct": 100,
      "free_learning_materials": ["14 Comprehensive Parts", "Hands-on Submission Grader", "Discord Community", "University Certificate"],
      "visual_proof": {
        "screenshot_path": "docs/screenshots/helsinki-fullstackopen.png",
        "screenshot_url": "docs/screenshots/helsinki-fullstackopen.png",
        "captured_at": "2026-10-24T12:00:00.000000+00:00",
        "status": "verified",
        "paywall_free_confirmed": true,
        "trial_trap_detected": false,
        "locked_modules_detected": false
      }
    },
    {
      "id": "helsinki-elements-of-ai",
      "title": "Elements of AI: Introduction to Artificial Intelligence",
      "institution": "University of Helsinki & Reaktor",
      "platform": "Elements of AI",
      "category": "Artificial Intelligence",
      "level": "Beginner",
      "duration_hours": 30,
      "url": "https://www.elementsofai.com/",
      "status": "Active",
      "certificate_offered": true,
      "certificate_type": "Free Verified Certificate",
      "prerequisites": "None (No math or programming required)",
      "verification_date": "2026-10-24",
      "inspection_notes": "Official Finnish government initiative to teach AI concepts globally. Free verified digital certificate on completion.",
      "is_paywall_free": true,